,Entry,Entry name,Status,Protein names,Gene names,Organism,Length,Post-translational modification
23,O14746,TERT_HUMAN,reviewed,Telomerase reverse transcriptase (EC 2.7.7.49) (HEST2) (Telomerase catalytic subunit) (Telomerase-associated protein 2) (TP2),TERT EST2 TCS1 TRT,Homo sapiens (Human),1132.0,"PTM: Phosphorylation at Tyr-707 under oxidative stress leads to translocation of TERT to the cytoplasm and reduces its antiapoptotic activity. Dephosphorylated by SHP2/PTPN11 leading to nuclear retention. Phosphorylation at Ser-227 by the AKT pathway promotes nuclear location. Phosphorylation at the G2/M phase at Ser-457 by DYRK2 promotes ubiquitination by the EDVP complex and degradation. {ECO:0000269|PubMed:12808100, ECO:0000269|PubMed:18829466, ECO:0000269|PubMed:22366458, ECO:0000269|PubMed:23362280}.; PTM: Ubiquitinated by the EDVP complex, a E3 ligase complex following phosphorylation at Ser-457 by DYRK2. Ubiquitinated leads to proteasomal degradation. {ECO:0000269|PubMed:23362280}.; PTM: (Microbial infection) In case of infection by HIV-1, the EDVP complex is hijacked by HIV-1 via interaction between HIV-1 Vpr and DCAF1/VPRBP, leading to ubiquitination and degradation. {ECO:0000269|PubMed:23362280}."
24,P49792,RBP2_HUMAN,reviewed,E3 SUMO-protein ligase RanBP2 (EC 2.3.2.-) (358 kDa nucleoporin) (Nuclear pore complex protein Nup358) (Nucleoporin Nup358) (Ran-binding protein 2) (RanBP2) (p270),RANBP2 NUP358,Homo sapiens (Human),3224.0,"PTM: Polyubiquitinated by PRKN, which leads to proteasomal degradation. {ECO:0000269|PubMed:16332688}.; PTM: The inner channel of the NPC has a different redox environment from the cytoplasm and allows the formation of interchain disulfide bonds between some nucleoporins, the significant increase of these linkages upon oxidative stress reduces the permeability of the NPC. {ECO:0000250|UniProtKB:Q9ERU9}."
25,P42684,ABL2_HUMAN,reviewed,Tyrosine-protein kinase ABL2 (EC 2.7.10.2) (Abelson murine leukemia viral oncogene homolog 2) (Abelson tyrosine-protein kinase 2) (Abelson-related gene protein) (Tyrosine-protein kinase ARG),ABL2 ABLL ARG,Homo sapiens (Human),1182.0,PTM: Phosphorylated at Tyr-261 by ABL1 in response to oxidative stress. Phosphorylated by PDGFRB (By similarity). {ECO:0000250}.; PTM: Polyubiquitinated. Polyubiquitination of ABL2 leads to degradation. {ECO:0000269|PubMed:15735735}.
26,Q96IL0,COA8_HUMAN,reviewed,"Cytochrome c oxidase assembly factor 8 (COA8) (Apoptogenic protein 1, mitochondrial) (APOP-1)",COA8 APOP1 APOPT1 C14orf153,Homo sapiens (Human),206.0,"PTM: N-terminal mitochondrial targeting sequence is cleaved from the mature protein once in the mitochondrion. {ECO:0000269|PubMed:25175347, ECO:0000269|PubMed:30552096}.; PTM: In normal conditions, the cytoplasmic precursor protein is rapidly degraded by the ubiquitination-proteasome system (UPS). Oxidative stress induces protein stabilization and import into mitochondria where it protects COX from degradation. {ECO:0000269|PubMed:25175347, ECO:0000269|PubMed:30552096}."
27,P16615,AT2A2_HUMAN,reviewed,"Sarcoplasmic/endoplasmic reticulum calcium ATPase 2 (SERCA2) (SR Ca(2+)-ATPase 2) (EC 7.2.2.10) (Calcium pump 2) (Calcium-transporting ATPase sarcoplasmic reticulum type, slow twitch skeletal muscle isoform) (Endoplasmic reticulum class 1/2 Ca(2+) ATPase)",ATP2A2 ATP2B,Homo sapiens (Human),1042.0,"PTM: Nitrated under oxidative stress. Nitration on the two tyrosine residues inhibits catalytic activity. {ECO:0000269|PubMed:16399855}.; PTM: Serotonylated on Gln residues by TGM2 in response to hypoxia, leading to its inactivation. {ECO:0000250|UniProtKB:O55143}."
28,Q9Y4P1,ATG4B_HUMAN,reviewed,Cysteine protease ATG4B (EC 3.4.22.-) (AUT-like 1 cysteine endopeptidase) (Autophagy-related cysteine endopeptidase 1) (Autophagin-1) (Autophagy-related protein 4 homolog B) (HsAPG4B) (hAPG4B),ATG4B APG4B AUTL1 KIAA0943,Homo sapiens (Human),393.0,"PTM: Phosphorylation at Ser-383 and Ser-392 promotes autophagy by increasing protein delipidation activity without affecting proteolytic activation of ATG8 proteins (PubMed:26378241). Phosphorylation at Ser-316 by ULK1 inhibits autophagy by decreasing both proteolytic activation and delipidation activities (PubMed:28821708). Phosphorylation at Ser-316 is dephosphorylated by protein phosphatase 2A (PP2A) (PubMed:28821708). Phosphorylation at Ser-34 by AKT2 promotes its hydrolase activity, leading to increased proteolytic activation and delipidation of ATG8 family proteins (PubMed:30443548). Phosphorylation at Ser-34 by AKT1 promotes mitochondrial localization and inhibition of the F1F0-ATP synthase activity, leading to elevation of mitochondrial reactive oxygen species (ROS) (PubMed:29165041). {ECO:0000269|PubMed:26378241, ECO:0000269|PubMed:28821708, ECO:0000269|PubMed:29165041, ECO:0000269|PubMed:30443548}.; PTM: Ubiquitinated by RNF5, leading to its degradation by the proteasome. {ECO:0000269|PubMed:23093945}.; PTM: S-nitrosylation at Cys-189 and Cys-292 in response to high glucose decreases both proteolytic activation and delipidation activities. {ECO:0000269|PubMed:28633005}.; PTM: O-glycosylated by OGT, leading to increase protease activity, thereby promoting the proteolytic activation of ATG8 family proteins. {ECO:0000269|PubMed:27527864}.; PTM: Forms reversible intrachain disulfide bonds in response to oxidative stress (PubMed:31880198). Forms interchain disulfide bonds, leading to formation of homooligomers in response to oxidation (PubMed:31880198). {ECO:0000269|PubMed:31880198}."
29,Q9BYV9,BACH2_HUMAN,reviewed,Transcription regulator protein BACH2 (BTB and CNC homolog 2),BACH2,Homo sapiens (Human),841.0,PTM: Phosphorylation at Ser-521 downstream of the PI-3K pathway promotes nuclear export. {ECO:0000269|PubMed:17018862}.; PTM: The reversible disulfide bond may provide a mechanism to regulate the activity in oxidative stress responses. {ECO:0000269|PubMed:22194330}.
30,P07451,CAH3_HUMAN,reviewed,Carbonic anhydrase 3 (EC 4.2.1.1) (Carbonate dehydratase III) (Carbonic anhydrase III) (CA-III),CA3,Homo sapiens (Human),260.0,PTM: S-glutathionylated in hepatocytes under oxidative stress. {ECO:0000250}.
31,O43524,FOXO3_HUMAN,reviewed,Forkhead box protein O3 (AF6q21 protein) (Forkhead in rhabdomyosarcoma-like 1),FOXO3 FKHRL1 FOXO3A,Homo sapiens (Human),673.0,"PTM: In the presence of survival factors such as IGF-1, phosphorylated on Thr-32 and Ser-253 by AKT1/PKB (PubMed:10102273). This phosphorylated form then interacts with 14-3-3 proteins and is retained in the cytoplasm (PubMed:10102273). Survival factor withdrawal induces dephosphorylation and promotes translocation to the nucleus where the dephosphorylated protein induces transcription of target genes and triggers apoptosis (PubMed:10102273). Although AKT1/PKB doesn't appear to phosphorylate Ser-315 directly, it may activate other kinases that trigger phosphorylation at this residue (PubMed:10102273, PubMed:11154281). Phosphorylated by STK4/MST1 on Ser-209 upon oxidative stress, which leads to dissociation from YWHAB/14-3-3-beta and nuclear translocation (PubMed:16751106). Phosphorylated by PIM1 (PubMed:18593906). Phosphorylation by AMPK leads to the activation of transcriptional activity without affecting subcellular localization (PubMed:17711846). In response to metabolic stress, phosphorylated by AMPK on Ser-30 which mediates FOXO3 mitochondrial translocation (PubMed:29445193). Phosphorylation by MAPKAPK5 promotes nuclear localization and DNA-binding, leading to induction of miR-34b and miR-34c expression, 2 post-transcriptional regulators of MYC that bind to the 3'UTR of MYC transcript and prevent its translation (PubMed:21329882). Phosphorylated by CHUK/IKKA and IKBKB/IKKB (PubMed:15084260). TNF-induced inactivation of FOXO3 requires its phosphorylation at Ser-644 by IKBKB/IKKB which promotes FOXO3 retention in the cytoplasm, polyubiquitination and ubiquitin-mediated proteasomal degradation (PubMed:15084260). May be dephosphorylated by calcineurin A on Ser-299 which abolishes FOXO3 transcriptional activity (By similarity). In cancer cells, ERK mediated-phosphorylation of Ser-12 is required for mitochondrial translocation of FOXO3 in response to metabolic stress or chemotherapeutic agents (PubMed:29445193). Phosphorylation at Ser-253 promotes its degradation by the proteasome (PubMed:30513302). Dephosphorylation at Ser-253 by protein phosphatase 2A (PPP2CA) promotes its stabilization; interaction with PPP2CA is enhanced by AMBRA1 (PubMed:30513302). {ECO:0000250|UniProtKB:Q9WVH4, ECO:0000269|PubMed:10102273, ECO:0000269|PubMed:11154281, ECO:0000269|PubMed:15084260, ECO:0000269|PubMed:16751106, ECO:0000269|PubMed:17711846, ECO:0000269|PubMed:18593906, ECO:0000269|PubMed:21329882, ECO:0000269|PubMed:29445193, ECO:0000269|PubMed:30513302}.; PTM: Deacetylation by SIRT1 or SIRT2 stimulates interaction of FOXO3 with SKP2 and facilitates SCF(SKP2)-mediated FOXO3 ubiquitination and proteasomal degradation (PubMed:21841822). Deacetylation by SIRT2 stimulates FOXO3-mediated transcriptional activity in response to oxidative stress (By similarity). Deacetylated by SIRT3 (PubMed:23283301). Deacetylation by SIRT3 stimulates FOXO3-mediated mtDNA transcriptional activity in response to metabolic stress (PubMed:23283301). {ECO:0000250|UniProtKB:Q9WVH4, ECO:0000269|PubMed:21841822, ECO:0000269|PubMed:23283301}.; PTM: Heavily methylated by SET9 which decreases stability, while moderately increasing transcriptional activity. The main methylation site is Lys-271. Methylation doesn't affect subcellular location. {ECO:0000269|PubMed:22820736}.; PTM: Polyubiquitinated. Ubiquitinated by a SCF complex containing SKP2, leading to proteasomal degradation. {ECO:0000269|PubMed:21841822}.; PTM: The N-terminus is cleaved following import into the mitochondrion. {ECO:0000269|PubMed:29445193}."
32,Q14145,KEAP1_HUMAN,reviewed,Kelch-like ECH-associated protein 1 (Cytosolic inhibitor of Nrf2) (INrf2) (Kelch-like protein 19),KEAP1 INRF2 KIAA0132 KLHL19,Homo sapiens (Human),624.0,"PTM: Non-enzymatic covalent modifications of reactive cysteines by electrophile metabolites inactivate the BCR(KEAP1) complex (PubMed:17127771, PubMed:18251510, PubMed:29590092, PubMed:30323285). Accumulation of fumarate promotes the formation of cysteine S-succination (S-(2-succinyl)cysteine), leading to inactivate the BCR(KEAP1) complex and promote NFE2L2/NRF2 nuclear accumulation and activation (By similarity). Nitric oxide-dependent 8-Nitro-cGMP formation promotes cysteine guanylation (S-cGMP-cysteine), leading to NFE2L2/NRF2 nuclear accumulation and activation (By similarity). Itaconate, an anti-inflammatory metabolite generated in response to lipopolysaccharide, alkylates cysteines, activating NFE2L2/NRF2 (PubMed:29590092). Methylglyoxal, a reactive metabolite that accumulates when the glycolytic enzyme PGK1 is inhibited, promotes formation of a methylimidazole cross-link between proximal Cys-151 and Arg-135 on another KEAP1 molecule, resulting in an inactive dimer that inactivates the BCR(KEAP1) complex (PubMed:30323285). {ECO:0000250|UniProtKB:Q9Z2X8, ECO:0000269|PubMed:17127771, ECO:0000269|PubMed:18251510, ECO:0000269|PubMed:29590092, ECO:0000269|PubMed:30323285}.; PTM: Degraded via a proteasomal-independent process during selective autophagy: interaction with phosphorylated SQSTM1/p62 sequesters KEAP1 in inclusion bodies, leading to its degradation. {ECO:0000269|PubMed:15983046, ECO:0000269|PubMed:20452972}.; PTM: Auto-ubiquitinated by the BCR(KEAP1) complex (PubMed:15572695, PubMed:15983046). Quinone-induced oxidative stress, but not sulforaphane, increases its ubiquitination (PubMed:15572695, PubMed:15983046). Ubiquitination and subsequent degradation is most pronounced following prolonged exposure of cells to oxidative stress, particularly in glutathione-deficient cells that are highly susceptible to oxidative stress (PubMed:15572695, PubMed:15983046). {ECO:0000269|PubMed:15572695, ECO:0000269|PubMed:15983046}."
33,O75694,NU155_HUMAN,reviewed,Nuclear pore complex protein Nup155 (155 kDa nucleoporin) (Nucleoporin Nup155),NUP155 KIAA0791,Homo sapiens (Human),1391.0,"PTM: Phosphorylated. Phosphorylation and dephosphorylation may be important for the function of NUP155 and may play a role in the reversible disassembly of the nuclear pore complex during mitosis (By similarity). {ECO:0000250}.; PTM: Disulfide-linked to NUP62. The inner channel of the NPC has a different redox environment from the cytoplasm and allows the formation of interchain disulfide bonds between some nucleoporins, the significant increase of these linkages upon oxidative stress reduces the permeability of the NPC (By similarity). {ECO:0000250}."
34,P07203,GPX1_HUMAN,reviewed,Glutathione peroxidase 1 (GPx-1) (GSHPx-1) (EC 1.11.1.9) (Cellular glutathione peroxidase),GPX1,Homo sapiens (Human),203.0,"PTM: During periods of oxidative stress, Sec-49 may react with a superoxide radical, irreversibly lose hydroselenide and be converted to dehydroalanine. {ECO:0000250}."
35,O14682,ENC1_HUMAN,reviewed,Ectoderm-neural cortex protein 1 (ENC-1) (Kelch-like protein 37) (Nuclear matrix protein NRP/B) (p53-induced gene 10 protein),ENC1 KLHL37 NRPB PIG10,Homo sapiens (Human),589.0,PTM: Ubiquitinated by E3 ubiquitin ligase complex formed by CUL3 and RBX1 and probably targeted for proteasome-independent degradation. Quinone-induced oxidative stress increases its ubiquitination. {ECO:0000269|PubMed:15983046}.
36,P04792,HSPB1_HUMAN,reviewed,Heat shock protein beta-1 (HspB1) (28 kDa heat shock protein) (Estrogen-regulated 24 kDa protein) (Heat shock 27 kDa protein) (HSP 27) (Stress-responsive protein 27) (SRP27),HSPB1 HSP27 HSP28,Homo sapiens (Human),205.0,"PTM: Phosphorylated upon exposure to protein kinase C activators and heat shock (PubMed:8325890). Phosphorylation by MAPKAPK2 and MAPKAPK3 in response to stress dissociates HSPB1 from large small heat-shock protein (sHsps) oligomers and impairs its chaperone activity and ability to protect against oxidative stress effectively. Phosphorylation by MAPKAPK5 in response to PKA stimulation induces F-actin rearrangement (PubMed:1332886, PubMed:8093612, PubMed:19166925). {ECO:0000269|PubMed:1332886, ECO:0000269|PubMed:19166925, ECO:0000269|PubMed:8093612, ECO:0000269|PubMed:8325890}."
37,Q9NRA8,4ET_HUMAN,reviewed,Eukaryotic translation initiation factor 4E transporter (4E-T) (eIF4E transporter) (Eukaryotic translation initiation factor 4E nuclear import factor 1),EIF4ENIF1,Homo sapiens (Human),985.0,"PTM: Phosphorylation by MAPK8/JNK1 and or MAPK9/JNK2 in response to oxidative stress promotes P-body assembly (PubMed:22966201). Phosphorylated during meiotic maturation (By similarity). {ECO:0000250|UniProtKB:Q9EST3, ECO:0000269|PubMed:22966201}."
38,Q9HAW0,BRF2_HUMAN,reviewed,Transcription factor IIIB 50 kDa subunit (TFIIIB50) (hTFIIIB50) (B-related factor 2) (BRF-2) (hBRFU),BRF2 BRFU PRO1470,Homo sapiens (Human),419.0,"PTM: In response to oxidative stress, Cys-361 is reversibly oxidized to cysteine sulfenic acid. Oxidation of Cys-361 impairs formation of a ternary complex with TBP and DNA and down-regulates expression of target genes in response to oxidative stress. {ECO:0000269|PubMed:26638071}."
39,Q03135,CAV1_HUMAN,reviewed,Caveolin-1,CAV1 CAV,Homo sapiens (Human),178.0,"PTM: Ubiquitinated. Undergo monoubiquitination and multi- and/or polyubiquitination (PubMed:21822278). Monoubiquitination of N-terminal lysines promotes integration in a ternary complex with UBXN6 and VCP which promotes oligomeric CAV1 targeting to lysosomes for degradation (PubMed:23335559). {ECO:0000269|PubMed:21822278, ECO:0000269|PubMed:23335559}.; PTM: The initiator methionine for isoform 2 is removed during or just after translation. The new N-terminal amino acid is then N-acetylated. {ECO:0000269|PubMed:15219854}.; PTM: Phosphorylated at Tyr-14 by ABL1 in response to oxidative stress. {ECO:0000269|PubMed:12531427, ECO:0000269|PubMed:15219854, ECO:0000269|PubMed:8632005}."
