,Entry,Entry name,Status,Protein names,Gene names,Organism,Length,Post-translational modification
0,Q16236,NF2L2_HUMAN,reviewed,"Nuclear factor erythroid 2-related factor 2 (NF-E2-related factor 2) (NFE2-related factor 2) (Nrf-2) (HEBP1) (Nuclear factor, erythroid derived 2, like 2)",NFE2L2 NRF2,Homo sapiens (Human),605.0,"PTM: Ubiquitinated in the cytoplasm by the BCR(KEAP1) E3 ubiquitin ligase complex leading to its degradation (PubMed:15601839, PubMed:15983046, PubMed:19489739). In response to oxidative stress, electrophile metabolites, such as sulforaphane, modify KEAP1, leading to inhibit activity of the BCR(KEAP1) complex, promoting NFE2L2/NRF2 nuclear accumulation and activity (PubMed:19489739, PubMed:29590092). In response to autophagy, the BCR(KEAP1) complex is inactivated (By similarity). {ECO:0000250|UniProtKB:Q60795, ECO:0000269|PubMed:15601839, ECO:0000269|PubMed:15983046, ECO:0000269|PubMed:19489739, ECO:0000269|PubMed:29590092}.; PTM: Phosphorylation of Ser-40 by PKC in response to oxidative stress dissociates NFE2L2 from its cytoplasmic inhibitor KEAP1, promoting its translocation into the nucleus. {ECO:0000250|UniProtKB:O54968}.; PTM: Acetylation at Lys-596 and Lys-599 increases nuclear localization whereas deacetylation by SIRT1 enhances cytoplasmic presence. {ECO:0000269|PubMed:21196497}.; PTM: Glycation impairs transcription factor activity by preventing heterodimerization with small Maf proteins (PubMed:31398338). Deglycation by FN3K restores activity (PubMed:31398338). {ECO:0000269|PubMed:31398338}."
1,Q9Y6E0,STK24_HUMAN,reviewed,Serine/threonine-protein kinase 24 (EC 2.7.11.1) (Mammalian STE20-like protein kinase 3) (MST-3) (STE20-like kinase MST3) [Cleaved into: Serine/threonine-protein kinase 24 36 kDa subunit (Mammalian STE20-like protein kinase 3 N-terminal) (MST3/N); Serine/threonine-protein kinase 24 12 kDa subunit (Mammalian STE20-like protein kinase 3 C-terminal) (MST3/C)],STK24 MST3 STK3,Homo sapiens (Human),443.0,"PTM: Proteolytically processed by caspases during apoptosis. Proteolytic cleavage results in kinase activation, nuclear translocation of the truncated form (MST3/N) and the induction of apoptosis. {ECO:0000269|PubMed:12107159}.; PTM: Isoform B is activated by phosphorylation by PKA. Oxidative stress induces phosphorylation. Activated by autophosphorylation at Thr-190 and phosphorylation at this site is essential for its function. Manganese, magnesium and cobalt-dependent autophosphorylation is mainly on threonine residues while zinc-dependent autophosphorylation is on both serine and threonine residues. {ECO:0000269|PubMed:10644707, ECO:0000269|PubMed:17046825, ECO:0000269|PubMed:19604147, ECO:0000269|PubMed:20124694}."
2,Q99683,M3K5_HUMAN,reviewed,Mitogen-activated protein kinase kinase kinase 5 (EC 2.7.11.25) (Apoptosis signal-regulating kinase 1) (ASK-1) (MAPK/ERK kinase kinase 5) (MEK kinase 5) (MEKK 5),MAP3K5 ASK1 MAPKKK5 MEKK5,Homo sapiens (Human),1374.0,"PTM: Phosphorylated at Thr-838 through autophosphorylation and by MAP3K6/ASK2 which leads to activation. Thr-838 is dephosphorylated by PPP5C. Ser-83 and Ser-1033 are inactivating phosphorylation sites, the former of which is phosphorylated by AKT1. Phosphorylated at Ser-966 which induces association of MAP3K5/ASK1 with the 14-3-3 family proteins and suppresses MAP3K5/ASK1 activity. Calcineurin (CN) dephosphorylates this site. Also dephosphorylated and activated by PGAM5. Phosphorylation at Ser-966 in response to oxidative stress is negatively regulated by PPIA/CYPA (PubMed:26095851). {ECO:0000269|PubMed:11154276, ECO:0000269|PubMed:11920685, ECO:0000269|PubMed:12556535, ECO:0000269|PubMed:14688258, ECO:0000269|PubMed:15094778, ECO:0000269|PubMed:16407264, ECO:0000269|PubMed:17210579, ECO:0000269|PubMed:17937911, ECO:0000269|PubMed:18948261, ECO:0000269|PubMed:19590015, ECO:0000269|PubMed:19749799, ECO:0000269|PubMed:23102700, ECO:0000269|PubMed:26095851}.; PTM: Ubiquitinated (PubMed:16038411, PubMed:17220297, PubMed:29186683). Tumor necrosis factor (TNF) induces TNFR2-dependent ubiquitination, leading to proteasomal degradation (PubMed:17220297). Ubiquitinated by RC3H2 in a TRIM48-dependent manner (PubMed:29186683). {ECO:0000269|PubMed:16038411, ECO:0000269|PubMed:17220297, ECO:0000269|PubMed:29186683}.; PTM: Methylation at Arg-78 and Arg-80 by PRMT1 promotes association of MAP3K5 with thioredoxin and negatively regulates MAP3K5 association with TRAF2, inhibiting MAP3K5 activation (PubMed:22095282). Methylation is blocked by ubiquitination of PRMT1 by TRIM48 (PubMed:29186683). {ECO:0000269|PubMed:22095282, ECO:0000269|PubMed:29186683}."
3,Q9BZL6,KPCD2_HUMAN,reviewed,Serine/threonine-protein kinase D2 (EC 2.7.11.13) (nPKC-D2),PRKD2 PKD2 HSPC187,Homo sapiens (Human),878.0,"PTM: Phosphorylation of Ser-876 correlates with the activation status of the kinase (PubMed:11062248). Ser-706 or/and Ser-710 are probably phosphorylated by PKC (PubMed:12058027, PubMed:28428613). Phosphorylation at Ser-244 by CSNK1D and CSNK1E promotes nuclear localization and substrate targeting (PubMed:17962809). Phosphorylation at Ser-244, Ser-706 and Ser-710 is required for nuclear localization (PubMed:17962809). Phosphorylated at Tyr-438 by ABL1 in response to oxidative stress (PubMed:15604256). Phosphorylated at Tyr-717 by ABL1 specifically in response to oxidative stress; requires prior phosphorylation at Ser-706 or/and Ser-710 (PubMed:28428613). {ECO:0000269|PubMed:11062248, ECO:0000269|PubMed:12058027, ECO:0000269|PubMed:15604256, ECO:0000269|PubMed:17962809, ECO:0000269|PubMed:28428613}."
4,Q15139,KPCD1_HUMAN,reviewed,Serine/threonine-protein kinase D1 (EC 2.7.11.13) (Protein kinase C mu type) (Protein kinase D) (nPKC-D1) (nPKC-mu),PRKD1 PKD PKD1 PRKCM,Homo sapiens (Human),912.0,"PTM: Phosphorylated at Ser-397 and Ser-401 by MAPK13 during regulation of insulin secretion in pancreatic beta cells (PubMed:19135240). Phosphorylated by DAPK1 (PubMed:17703233). Phosphorylated at Tyr-95 and by ABL at Tyr-463, which primes the kinase in response to oxidative stress, and promotes a second step activating phosphorylation at Ser-738/Ser-742 by PKRD (PubMed:12637538, PubMed:15024053, PubMed:17804414). Phosphorylated on Ser-910 upon S.enterica infection in macrophages (By similarity). {ECO:0000250|UniProtKB:Q62101, ECO:0000269|PubMed:12637538, ECO:0000269|PubMed:15024053, ECO:0000269|PubMed:17703233, ECO:0000269|PubMed:17804414, ECO:0000269|PubMed:19135240}."
5,Q9GZV1,ANKR2_HUMAN,reviewed,Ankyrin repeat domain-containing protein 2 (Skeletal muscle ankyrin repeat protein) (hArpp),ANKRD2 ARPP,Homo sapiens (Human),360.0,PTM: Phosphorylation at Ser-99 by PKB/AKT2 in response to oxidative stress induces translocation to the nucleus and negatively regulates myoblast differentiation. {ECO:0000269|PubMed:21737686}.
6,P08238,HS90B_HUMAN,reviewed,Heat shock protein HSP 90-beta (HSP 90) (Heat shock 84 kDa) (HSP 84) (HSP84),HSP90AB1 HSP90B HSPC2 HSPCB,Homo sapiens (Human),724.0,"PTM: Ubiquitinated in the presence of STUB1-UBE2D1 complex (in vitro). {ECO:0000269|PubMed:18042044}.; PTM: ISGylated. {ECO:0000269|PubMed:16139798}.; PTM: S-nitrosylated; negatively regulates the ATPase activity. {ECO:0000305|PubMed:19696785}.; PTM: Phosphorylation at Tyr-301 by SRC is induced by lipopolysaccharide (PubMed:23585225). Phosphorylation at Ser-226 and Ser-255 inhibits AHR interaction (PubMed:15581363). {ECO:0000269|PubMed:15581363, ECO:0000269|PubMed:23585225}.; PTM: Methylated by SMYD2; facilitates dimerization and chaperone complex formation; promotes cancer cell proliferation. {ECO:0000269|PubMed:24880080}.; PTM: Cleaved following oxidative stress resulting in HSP90AB1 protein radicals formation; disrupts the chaperoning function and the degradation of its client proteins. {ECO:0000269|PubMed:22848402}."
7,Q12778,FOXO1_HUMAN,reviewed,Forkhead box protein O1 (Forkhead box protein O1A) (Forkhead in rhabdomyosarcoma),FOXO1 FKHR FOXO1A,Homo sapiens (Human),655.0,"PTM: Phosphorylation by NLK promotes nuclear export and inhibits the transcriptional activity. In response to growth factors, phosphorylation on Thr-24, Ser-256 and Ser-322 by PKB/AKT1 promotes nuclear export and inactivation of transactivational activity. Phosphorylation on Thr-24 is required for binding 14-3-3 proteins. Phosphorylation of Ser-256 decreases DNA-binding activity and promotes the phosphorylation of Thr-24 and Ser-319, permitting phosphorylation of Ser-322 and Ser-325, probably by CDK1, leading to nuclear exclusion and loss of function. Stress signals, such as response to oxygen or nitric oxide, attenuate the PKB/AKT1-mediated phosphorylation leading to nuclear retention. Phosphorylation of Ser-329 is independent of IGF1 and leads to reduced function. Dephosphorylated on Thr-24 and Ser-256 by PP2A in beta-cells under oxidative stress leading to nuclear retention (By similarity). Phosphorylation of Ser-249 by CDK1 disrupts binding of 14-3-3 proteins leading to nuclear accumulation and has no effect on DNA-binding nor transcriptional activity. Phosphorylation by STK4/MST1 on Ser-212, upon oxidative stress, inhibits binding to 14-3-3 proteins and nuclear export. PPIA/CYPA promotes its dephosphorylation on Ser-256 (PubMed:31063815). {ECO:0000250|UniProtKB:Q9R1E0, ECO:0000269|PubMed:10358075, ECO:0000269|PubMed:10358076, ECO:0000269|PubMed:11237865, ECO:0000269|PubMed:11311120, ECO:0000269|PubMed:11980723, ECO:0000269|PubMed:18356527, ECO:0000269|PubMed:18786403, ECO:0000269|PubMed:19221179, ECO:0000269|PubMed:21245099, ECO:0000269|PubMed:31063815}.; PTM: Acetylated. Acetylation at Lys-262, Lys-265 and Lys-274 are necessary for autophagic cell death induction. Deacetylated by SIRT2 in response to oxidative stress or serum deprivation, thereby negatively regulating FOXO1-mediated autophagic cell death. {ECO:0000269|PubMed:20543840}.; PTM: Ubiquitinated by SKP2. Ubiquitination leads to proteasomal degradation. {ECO:0000269|PubMed:15668399}.; PTM: Methylation inhibits AKT1-mediated phosphorylation at Ser-256 and is increased by oxidative stress. {ECO:0000250}.; PTM: Once in the nucleus, acetylated by CREBBP/EP300. Acetylation diminishes the interaction with target DNA and attenuates the transcriptional activity. It increases the phosphorylation at Ser-256. Deacetylation by SIRT1 results in reactivation of the transcriptional activity. Oxidative stress by hydrogen peroxide treatment appears to promote deacetylation and uncoupling of insulin-induced phosphorylation. By contrast, resveratrol acts independently of acetylation. {ECO:0000269|PubMed:10358075, ECO:0000269|PubMed:10358076, ECO:0000269|PubMed:11237865, ECO:0000269|PubMed:11980723}."
8,P27695,APEX1_HUMAN,reviewed,"DNA-(apurinic or apyrimidinic site) endonuclease (EC 3.1.-.-) (APEX nuclease) (APEN) (Apurinic-apyrimidinic endonuclease 1) (AP endonuclease 1) (APE-1) (REF-1) (Redox factor-1) [Cleaved into: DNA-(apurinic or apyrimidinic site) endonuclease, mitochondrial]",APEX1 APE APE1 APEX APX HAP1 REF1,Homo sapiens (Human),318.0,"PTM: Phosphorylated. Phosphorylation by kinase PKC or casein kinase CK2 results in enhanced redox activity that stimulates binding of the FOS/JUN AP-1 complex to its cognate binding site. AP-endodeoxyribonuclease activity is not affected by CK2-mediated phosphorylation. Phosphorylation of Thr-233 by CDK5 reduces AP-endodeoxyribonuclease activity resulting in accumulation of DNA damage and contributing to neuronal death. {ECO:0000269|PubMed:10023679, ECO:0000269|PubMed:11452037}.; PTM: Acetylated on Lys-6 and Lys-7. Acetylation is increased by the transcriptional coactivator EP300 acetyltransferase, genotoxic agents like H(2)O(2) and methyl methanesulfonate (MMS). Acetylation increases its binding affinity to the negative calcium response element (nCaRE) DNA promoter. The acetylated form induces a stronger binding of YBX1 to the Y-box sequence in the MDR1 promoter than the unacetylated form. Deacetylated on lysines. Lys-6 and Lys-7 are deacetylated by SIRT1. {ECO:0000269|PubMed:14633989, ECO:0000269|PubMed:20699270}.; PTM: Cleaved at Lys-31 by granzyme A to create the mitochondrial form; leading in reduction of binding to DNA, AP endodeoxynuclease activity, redox activation of transcription factors and to enhanced cell death. Cleaved by granzyme K; leading to intracellular ROS accumulation and enhanced cell death after oxidative stress.; PTM: Cys-65 and Cys-93 are nitrosylated in response to nitric oxide (NO) and lead to the exposure of the nuclear export signal (NES). {ECO:0000269|PubMed:17403694}.; PTM: Ubiquitinated by MDM2; leading to translocation to the cytoplasm and proteasomal degradation. {ECO:0000269|PubMed:19219073}."
9,P04406,G3P_HUMAN,reviewed,Glyceraldehyde-3-phosphate dehydrogenase (GAPDH) (EC 1.2.1.12) (Peptidyl-cysteine S-nitrosylase GAPDH) (EC 2.6.99.-),GAPDH GAPD CDABP0047 OK/SW-cl.12,Homo sapiens (Human),335.0,"PTM: S-nitrosylation of Cys-152 leads to interaction with SIAH1, followed by translocation to the nucleus (By similarity). S-nitrosylation of Cys-247 is induced by interferon-gamma and LDL(ox) implicating the iNOS-S100A8/9 transnitrosylase complex and seems to prevent interaction with phosphorylated RPL13A and to interfere with GAIT complex activity (PubMed:22771119, PubMed:25417112). {ECO:0000250|UniProtKB:P04797, ECO:0000269|PubMed:22771119, ECO:0000269|PubMed:25417112}.; PTM: ISGylated. {ECO:0000305|PubMed:16815975}.; PTM: Sulfhydration at Cys-152 increases catalytic activity. {ECO:0000250|UniProtKB:P16858}.; PTM: Oxidative stress can promote the formation of high molecular weight disulfide-linked GAPDH aggregates, through a process called nucleocytoplasmic coagulation. Such aggregates can be observed in vivo in the affected tissues of patients with Alzheimer disease or alcoholic liver cirrhosis, or in cell cultures during necrosis. Oxidation at Met-46 may play a pivotal role in the formation of these insoluble structures. This modification has been detected in vitro following treatment with free radical donor (+/-)-(E)-4-ethyl-2-[(E)-hydroxyimino]-5-nitro-3-hexenamide. It has been proposed to destabilize nearby residues, increasing the likelihood of secondary oxidative damages, including oxidation of Tyr-45 and Met-105. This cascade of oxidations may augment GAPDH misfolding, leading to intermolecular disulfide cross-linking and aggregation. {ECO:0000305|PubMed:25086035}.; PTM: Succination of Cys-152 and Cys-247 by the Krebs cycle intermediate fumarate, which leads to S-(2-succinyl)cysteine residues, inhibits glyceraldehyde-3-phosphate dehydrogenase activity. Fumarate concentration as well as succination of cysteine residues in GAPDH is significantly increased in muscle of diabetic mammals. It was proposed that the S-(2-succinyl)cysteine chemical modification may be a useful biomarker of mitochondrial and oxidative stress in diabetes and that succination of GAPDH and other thiol proteins by fumarate may contribute to the metabolic changes underlying the development of diabetes complications. {ECO:0000250|UniProtKB:P04797}.; PTM: (Microbial infection) Glycosylated by C.rodentium protein NleB, enteropathogenic E.coli protein NleB1 and S.typhimurium protein Ssek1: arginine GlcNAcylation prevents the interaction with TRAF2 and TRAF3 (PubMed:23332158, PubMed:27387501, PubMed:28522607). This leads to reduced ubiquitination of TRAF2 and TRAF3, and subsequent inhibition of NF-kappa-B signaling and type I interferon production, respectively (PubMed:23332158, PubMed:27387501). {ECO:0000269|PubMed:23332158, ECO:0000269|PubMed:27387501, ECO:0000269|PubMed:28522607}."
10,O60662,KLH41_HUMAN,reviewed,Kelch-like protein 41 (Kel-like protein 23) (Kelch repeat and BTB domain-containing protein 10) (Kelch-related protein 1) (Sarcosin),KLHL41 KBTBD10 KRP1,Homo sapiens (Human),606.0,PTM: Ubiquitinated by E3 ubiquitin ligase complex formed by CUL3 and RBX1 and probably targeted for proteasome-independent degradation. Quinone-induced oxidative stress increases its ubiquitination. {ECO:0000269|PubMed:15983046}.
11,P98177,FOXO4_HUMAN,reviewed,Forkhead box protein O4 (Fork head domain transcription factor AFX1),FOXO4 AFX AFX1 MLLT7,Homo sapiens (Human),505.0,"PTM: Acetylation by CREBBP/CBP, which is induced by peroxidase stress, inhibits transcriptional activity. Deacetylation by SIRT1 is NAD-dependent and stimulates transcriptional activity. {ECO:0000269|PubMed:15126506}.; PTM: Phosphorylation by PKB/AKT1 inhibits transcriptional activity and is responsible for cytoplasmic localization. May be phosphorylated at multiple sites by NLK. {ECO:0000269|PubMed:10217147, ECO:0000269|PubMed:10518537, ECO:0000269|PubMed:16272144}.; PTM: Monoubiquitinated; monoubiquitination is induced by oxidative stress and reduced by deacetylase inhibitors; results in its relocalization to the nucleus and its increased transcriptional activity. Deubiquitinated by USP7; deubiquitination is induced by oxidative stress; enhances its interaction with USP7 and consequently, deubiquitination; increases its translocation to the cytoplasm and inhibits its transcriptional activity. Hydrogene-peroxide-induced ubiquitination and USP7-mediated deubiquitination have no major effect on its protein stability. {ECO:0000269|PubMed:16964248}."
12,Q14995,NR1D2_HUMAN,reviewed,Nuclear receptor subfamily 1 group D member 2 (Orphan nuclear hormone receptor BD73) (Rev-erb alpha-related receptor) (RVR) (Rev-erb-beta) (V-erbA-related protein 1-related) (EAR-1R),NR1D2,Homo sapiens (Human),579.0,"PTM: Deacetylated by HDAC1. Acetylation and deacetylation regulate its transcriptional regulatory activity. {ECO:0000269|PubMed:17996965}.; PTM: Under more reducing intracellular redox conditions, Cys-384 is in its heme-bound state, which is optimal for recruitment of the NCOR1/HDAC3 corepressor complex and repression of target genes. When subjected to oxidative stress conditions, Cys-384 undergoes oxidation to form a disulfide bridge with Cys-374, also triggering a ligand switch that results in release of bound heme and derepression of target genes. {ECO:0000269|PubMed:21123168}.; PTM: Ubiquitinated by SIAH2; leading to proteasomal degradation. {ECO:0000269|PubMed:26392558}.; PTM: Phosphorylated by CSNK1E; phosphorylation enhances its cytoplasmic localization. {ECO:0000250|UniProtKB:Q60674}."
13,O15304,SIVA_HUMAN,reviewed,Apoptosis regulatory protein Siva (CD27-binding protein) (CD27BP),SIVA1 SIVA,Homo sapiens (Human),175.0,PTM: Phosphorylated by ABL2/ARG in response to oxidative stress. {ECO:0000269|PubMed:11278261}.
14,P37198,NUP62_HUMAN,reviewed,Nuclear pore glycoprotein p62 (62 kDa nucleoporin) (Nucleoporin Nup62),NUP62,Homo sapiens (Human),522.0,"PTM: O-glycosylated. Contains about 10 N-acetylglucosamine side chain sites predicted for the entire protein, among which only one in the C-terminal. {ECO:0000305}.; PTM: The inner channel of the NPC has a different redox environment from the cytoplasm and allows the formation of interchain disulfide bonds between some nucleoporins, the significant increase of these linkages upon oxidative stress reduces the permeability of the NPC. {ECO:0000250}."
15,P30041,PRDX6_HUMAN,reviewed,Peroxiredoxin-6 (EC 1.11.1.27) (1-Cys peroxiredoxin) (1-Cys PRX) (24 kDa protein) (Acidic calcium-independent phospholipase A2) (aiPLA2) (EC 3.1.1.4) (Antioxidant protein 2) (Glutathione-dependent peroxiredoxin) (Liver 2D page spot 40) (Lysophosphatidylcholine acyltransferase 5) (LPC acyltransferase 5) (LPCAT-5) (Lyso-PC acyltransferase 5) (EC 2.3.1.23) (Non-selenium glutathione peroxidase) (NSGPx) (Red blood cells page spot 12),PRDX6 AOP2 KIAA0106,Homo sapiens (Human),224.0,"PTM: Irreversibly inactivated by overoxidation of Cys-47 to sulfinic acid (Cys-SO(2)H) and sulfonic acid (Cys-SO(3)H) forms upon oxidative stress. {ECO:0000269|PubMed:12059788, ECO:0000269|PubMed:27353378}.; PTM: Phosphorylation at Thr-177 by MAP kinases increases the phospholipase activity of the enzyme (By similarity). The phosphorylated form exhibits a greater lysophosphatidylcholine acyltransferase activity compared to the non-phosphorylated form (PubMed:26830860). {ECO:0000250|UniProtKB:O35244, ECO:0000269|PubMed:26830860}."
16,Q99497,PARK7_HUMAN,reviewed,Parkinson disease protein 7 (Maillard deglycase) (Oncogene DJ1) (Parkinsonism-associated deglycase) (Protein DJ-1) (DJ-1) (Protein/nucleic acid deglycase DJ-1) (EC 3.1.2.-) (EC 3.5.1.-) (EC 3.5.1.124),PARK7,Homo sapiens (Human),189.0,"PTM: Sumoylated on Lys-130 by PIAS2 or PIAS4; which is enhanced after ultraviolet irradiation and essential for cell-growth promoting activity and transforming activity. {ECO:0000269|PubMed:15976810}.; PTM: Cys-106 is easily oxidized to sulfinic acid. {ECO:0000269|PubMed:12939276, ECO:0000269|PubMed:15976810}.; PTM: Undergoes cleavage of a C-terminal peptide and subsequent activation of protease activity in response to oxidative stress. {ECO:0000269|PubMed:20304780}."
17,Q92835,SHIP1_HUMAN,reviewed,"Phosphatidylinositol 3,4,5-trisphosphate 5-phosphatase 1 (EC 3.1.3.86) (Inositol polyphosphate-5-phosphatase D) (EC 3.1.3.56) (Inositol polyphosphate-5-phosphatase of 145 kDa) (SIP-145) (Phosphatidylinositol 4,5-bisphosphate 5-phosphatase) (EC 3.1.3.36) (SH2 domain-containing inositol 5'-phosphatase 1) (SH2 domain-containing inositol phosphatase 1) (SHIP-1) (p150Ship) (hp51CN)",INPP5D SHIP SHIP1,Homo sapiens (Human),1189.0,"PTM: Tyrosine phosphorylated by the members of the SRC family after exposure to a diverse array of extracellular stimuli such as cytokines, growth factors, antibodies, chemokines, integrin ligands and hypertonic and oxidative stress. Phosphorylated upon IgG receptor FCGR2B-binding. {ECO:0000269|PubMed:10822173, ECO:0000269|PubMed:9108392}."
18,O15357,SHIP2_HUMAN,reviewed,"Phosphatidylinositol 3,4,5-trisphosphate 5-phosphatase 2 (EC 3.1.3.86) (Inositol polyphosphate phosphatase-like protein 1) (INPPL-1) (Protein 51C) (SH2 domain-containing inositol 5'-phosphatase 2) (SH2 domain-containing inositol phosphatase 2) (SHIP-2)",INPPL1 SHIP2,Homo sapiens (Human),1258.0,"PTM: Tyrosine phosphorylated by the members of the SRC family after exposure to a diverse array of extracellular stimuli such as insulin, growth factors such as EGF or PDGF, chemokines, integrin ligands and hypertonic and oxidative stress. May be phosphorylated upon IgG receptor FCGR2B-binding. Phosphorylated at Tyr-986 following cell attachment and spreading. Phosphorylated at Tyr-1162 following EGF signaling pathway stimulation. Phosphorylated at Thr-958 in response to PDGF. {ECO:0000269|PubMed:10194451, ECO:0000269|PubMed:11158326, ECO:0000269|PubMed:11349134, ECO:0000269|PubMed:11687594, ECO:0000269|PubMed:12235291, ECO:0000269|PubMed:12690104, ECO:0000269|PubMed:17219406, ECO:0000269|PubMed:9660833}."
19,Q6SZW1,SARM1_HUMAN,reviewed,NAD(+) hydrolase SARM1 (NADase SARM1) (hSARM1) (EC 3.2.2.6) (NADP(+) hydrolase SARM1) (EC 3.2.2.-) (Sterile alpha and Armadillo repeat protein) (Sterile alpha and TIR motif-containing protein 1) (Sterile alpha motif domain-containing protein 2) (MyD88-5) (SAM domain-containing protein 2) (Tir-1 homolog) (HsTIR),SARM1 KIAA0524 SAMD2 SARM,Homo sapiens (Human),724.0,"PTM: Phosphorylation at Ser-548 by JNK kinases (MAPK8, MAPK9 and /or MAPK10) enhance the NAD(+) hydrolase (NADase) activity (PubMed:30333228). Phosphorylation at Ser-548 and subsequent activation takes place in response to oxidative stress conditions and inhibits mitochondrial respiration (PubMed:30333228). {ECO:0000269|PubMed:30333228}."
20,P04179,SODM_HUMAN,reviewed,"Superoxide dismutase [Mn], mitochondrial (EC 1.15.1.1)",SOD2,Homo sapiens (Human),222.0,"PTM: Nitrated under oxidative stress. Nitration coupled with oxidation inhibits the catalytic activity. {ECO:0000269|PubMed:10334867, ECO:0000269|PubMed:16399855}.; PTM: Acetylation at Lys-122 decreases enzymatic activity. Deacetylated by SIRT3 upon exposure to ionizing radiations or after long fasting (By similarity). {ECO:0000250|UniProtKB:P09671}.; PTM: Polyubiquitinated; leading to proteasomal degradation. Deubiquitinated by USP36 which increases protein stability. {ECO:0000269|PubMed:21268071}."
21,O43865,SAHH2_HUMAN,reviewed,S-adenosylhomocysteine hydrolase-like protein 1 (DC-expressed AHCY-like molecule) (IP(3)Rs binding protein released with IP(3)) (IRBIT) (Putative adenosylhomocysteinase 2) (S-adenosyl-L-homocysteine hydrolase 2) (AdoHcyase 2),AHCYL1 DCAL IRBIT XPVKONA,Homo sapiens (Human),530.0,"PTM: Phosphorylated at Ser/Thr residues between Ser-68 and Thr-72 in the PEST region: required for interaction with dATP-bound RRM1 and ITPR1. Phosphorylation at Ser-68 by PRKD1 and CAMK4 is required for further phosphorylations by CSNK1A1 (PubMed:16793548). Phosphorylation is induced by oxidative stress (PubMed:19224921). Probably phosphorylated by CAMK2A; phosphorylation at Ser-68 may be required for interaction with SLC9A3 (PubMed:20584908). Dephosphorylated in response to apoptotic stress conditions which causes translocation of both AHCYL1 and BCL2L10 from mitochondria-associated endoplasmic reticulum membranes and promotes apoptosis (PubMed:27995898). {ECO:0000269|PubMed:16793548, ECO:0000269|PubMed:19224921, ECO:0000269|PubMed:25237103, ECO:0000269|PubMed:27995898, ECO:0000305|PubMed:20584908}."
22,P09493,TPM1_HUMAN,reviewed,Tropomyosin alpha-1 chain (Alpha-tropomyosin) (Tropomyosin-1),TPM1 C15orf13 TMSA,Homo sapiens (Human),284.0,PTM: Phosphorylated at Ser-283 by DAPK1 in response to oxidative stress and this phosphorylation enhances stress fiber formation in endothelial cells. {ECO:0000269|PubMed:17895359}.
